<?xml version="1.0" encoding="UTF-8" standalone="no"?>

<tc:breakfast-menu xmlns:tc="http://www.tc.by/breakfastMenu"
xmlns:xsi="http://www.w3.org/2001/XMLSchema-instance"
xsi:schemaLocation="http://www.tc.by/breakfastMenu breakfastMenu.xsd">

	<food id="1" status="true">
		<name>Belgian Waffles</name>
		<price>$5.95</price>
		<description>
			two of our famous Belgian Waffles with plenty of real
			maple syrup
		</description>
		<calories>650</calories>
	</food>

	<food id="2" status="false">
		<name>Strawberry Belgian Waffles</name>
		<price>$7.95</price>
		<description>
			light Belgian waffles covered with strawberries and
			whipped cream
		</description>
		<calories>650</calories>
	</food>

</tc:breakfast-menu>